<?xml version="1.0" encoding="utf-8"?>
<xs:schema xmlns="http://www.uniovi.es" elementFormDefault="qualified" targetNamespace="http://www.uniovi.es" xmlns:xs="http://www.w3.org/2001/XMLSchema">
	<xs:element name="circuito">
		<xs:complexType>
			<xs:sequence>
				<xs:element ref="nombre" />
				<xs:element ref="longitudTramo" />
				<xs:element ref="anchuraTramo" />
				<xs:element ref="fecha" />
				<xs:element ref="inicio" />
				<xs:element ref="vueltas" />
				<xs:element ref="localidadProx" />
				<xs:element ref="pais" />
				<xs:element ref="patrocinador" />
				<xs:element ref="referencias" />
				<xs:element ref="fotos" />
				<xs:element ref="videos" />
				<xs:element ref="puntos" />
				<xs:element ref="vencedor" />
				<xs:element ref="clasificados" />
			</xs:sequence>
		</xs:complexType>
	</xs:element>
	<xs:simpleType name="anchoMedida">
		<xs:restriction base="xs:nonNegativeInteger">
			<xs:minInclusive value="0"/>
			<xs:maxInclusive value="100"/>
		</xs:restriction>
	</xs:simpleType>
	<xs:simpleType name="longitudMedida">
		<xs:restriction base="xs:nonNegativeInteger">
			<xs:minInclusive value="0"/>
			<xs:maxInclusive value="10000"/>
		</xs:restriction>
	</xs:simpleType>
	<xs:element name="nombre" type="xs:string" />
	<xs:element name="longitudTramo">
		<xs:complexType>
			<xs:simpleContent>
				<xs:extension base="longitudMedida">
					<xs:attribute name="unidades" type="xs:string" use="required" />
				</xs:extension>
			</xs:simpleContent>
		</xs:complexType>
	</xs:element>
	<xs:element name="anchuraTramo">
		<xs:complexType>
			<xs:simpleContent>
				<xs:extension base="anchoMedida">
					<xs:attribute name="unidades" type="xs:string" use="required" />
				</xs:extension>
			</xs:simpleContent>
		</xs:complexType>
	</xs:element>
	<xs:element name="fecha" type="xs:date" />
	<xs:element name="inicio" type="xs:time" />
	<xs:element name="vueltas" type="xs:nonNegativeInteger" />
	<xs:element name="localidadProx" type="xs:string" />
	<xs:element name="pais" type="xs:string" />
	<xs:element name="patrocinador" type="xs:string" />
	<xs:element name="referencias">
		<xs:complexType>
			<xs:sequence>
				<xs:element minOccurs="3" maxOccurs="unbounded" ref="referencia" />
			</xs:sequence>
		</xs:complexType>
	</xs:element>
	<xs:element name="referencia">
		<xs:complexType>
			<xs:simpleContent>
				<xs:extension base="xs:string">
					<xs:attribute name="rDescripcion" type="xs:string" use="required" />
					<xs:attribute name="url" type="xs:string" use="required" />
				</xs:extension>
			</xs:simpleContent>
		</xs:complexType>
	</xs:element>
	<xs:element name="fotos">
		<xs:complexType>
			<xs:sequence>
				<xs:element minOccurs="1" maxOccurs="5" ref="foto" />
			</xs:sequence>
		</xs:complexType>
	</xs:element>
	<xs:element name="foto">
		<xs:complexType>
			<xs:simpleContent>
				<xs:extension base="xs:string">
					<xs:attribute name="fDescripcion" type="xs:string" use="required" />
				</xs:extension>
			</xs:simpleContent>
		</xs:complexType>
	</xs:element>
	<xs:element name="videos">
		<xs:complexType>
			<xs:sequence>
				<xs:element minOccurs="1" maxOccurs="3" ref="video" />
			</xs:sequence>
		</xs:complexType>
	</xs:element>
	<xs:element name="video">
		<xs:complexType>
			<xs:simpleContent>
				<xs:extension base="xs:string">
					<xs:attribute name="vDescripcion" type="xs:string" use="required" />
				</xs:extension>
			</xs:simpleContent>
		</xs:complexType>
	</xs:element>
	<xs:element name="puntos">
		<xs:complexType>
			<xs:sequence>
				<xs:element minOccurs="0" maxOccurs="unbounded" ref="punto" />
			</xs:sequence>
		</xs:complexType>
	</xs:element>
	<xs:element name="punto">
		<xs:complexType>
			<xs:sequence>
				<xs:element ref="pLongitud" />
				<xs:element ref="pLatitud" />
				<xs:element ref="pAltitud" />
			</xs:sequence>
		</xs:complexType>
	</xs:element>
	<xs:simpleType name="coordenada">
		<xs:restriction base="xs:float">
			<xs:minInclusive value="-180.0"/>
			<xs:maxInclusive value="180.0"/>
		</xs:restriction>
	</xs:simpleType>
	<xs:simpleType name="altitudTipo">
		<xs:restriction base="xs:float">
			<xs:minInclusive value="0.0"/>
			<xs:maxInclusive value="3000.0"/>
		</xs:restriction>
	</xs:simpleType>

	<xs:element name="pLongitud" type="coordenada" />
	<xs:element name="pLatitud" type="coordenada" />
	<xs:element name="pAltitud" type="altitudTipo" />
	
	<xs:element name="vencedor">
		<xs:complexType>
			<xs:simpleContent>
				<xs:extension base="xs:string">
					<xs:attribute name="tiempo" type="xs:duration" use="required" />
				</xs:extension>
			</xs:simpleContent>
		</xs:complexType>
	</xs:element>
	<xs:element name="clasificados">
		<xs:complexType>
			<xs:sequence>
				<xs:element minOccurs="3" maxOccurs="3" ref="clasificado" />
			</xs:sequence>
		</xs:complexType>
	</xs:element>
	<xs:element name="clasificado" type="xs:string" />
</xs:schema>